{
  "schema": "pipeline.adoption-state.v1",
  "state": "approved-scoped",
  "scope": [
    "specs/sprint-alfred-epic/"
  ],
  "decidedAt": "2026-10-22T18:00:00.000Z",
  "expiresAt": null,
  "reviewDate": "2026-11-30",
  "decisionRef": "po-0.7.0-adopt-2026-10-22",
  "rationale": "PO decision 2026-10-22: adopt the staged architecture proposal for the Alfred epic scope as the D4 dogfood decision for AC-9",
  "coverageClass": "evaluated",
  "confidence": "measured",
  "by": "PO",
  "authority": {
    "mode": "signature",
    "request": {
      "schema": "pipeline.adoption-approval-request.v1",
      "mode": "signature",
      "intent": {
        "value": {
          "schema": "pipeline.po-approval-intent.v1",
          "kind": "architecture-adoption",
          "featureId": "architecture-adoption",
          "planSha256": "aba3345eed5d3548d532083e44e503ac16cd9b265ccfedb5b299d500a0bb818e",
          "specSha256": "a3e84c723b1b8c920f34bec1cdb8d195b6b007ac6ccec19f00d25fe432a64c06",
          "candidate": {
            "commit": "540e96f7137996da1310c38e52a56077556901b0",
            "tree": "7be0a60fd63bd1b1445e196562fe4c69bcc28fb7"
          },
          "policyRevision": "adoption-authority-v1",
          "subjectSha256": "265f4bf98a87a8fed004b32fbb36574685637ef0ffebe4ce4890e873afac0ea5",
          "decision": "approved-scoped"
        },
        "sha256": "03c98952520d7113adede5ad1b336ae487fef96792bbf72ef04e572d39afee71"
      },
      "subject": {
        "repositoryFingerprint": "302ed2e35840718b1e4b1bd215e8dd61bbe6e92a17ed28d2694741e5d4509353",
        "decision": "approved-scoped",
        "scope": [
          "specs/sprint-alfred-epic/"
        ],
        "rationale": "PO decision 2026-10-22: adopt the staged architecture proposal for the Alfred epic scope as the D4 dogfood decision for AC-9",
        "decidedAt": "2026-10-22T18:00:00.000Z",
        "expiresAt": null,
        "reviewDate": "2026-11-30",
        "decisionRef": "po-0.7.0-adopt-2026-10-22",
        "candidate": {
          "commit": "540e96f7137996da1310c38e52a56077556901b0",
          "tree": "7be0a60fd63bd1b1445e196562fe4c69bcc28fb7"
        },
        "profileSha256": "03102ea369d0300ff2aca3ec42f2e7ec55c44784faf45b3d51ee2632f3e2d6b8",
        "modelSha256": "c3861faaa1a70988556233712e6027dbb9b5cf64551d5bfb990a06c4b9e9d763",
        "moduleSnapshotSha256": "e576f5b585fb0e8a747af9f1be3a63aa1dff3238337da799bfcb4a8d7ac4b3f5"
      },
      "subjectSha256": "265f4bf98a87a8fed004b32fbb36574685637ef0ffebe4ce4890e873afac0ea5"
    },
    "proof": {
      "schema": "pipeline.po-approval-proof.v1",
      "intentSha256": "03c98952520d7113adede5ad1b336ae487fef96792bbf72ef04e572d39afee71",
      "keyReference": "local-po-key",
      "publicKey": "-----BEGIN PUBLIC KEY-----\nMCowBQYDK2VwAyEAULJPLmcfrK+fF6yLn8YPL2Bj0ohgMIKiB/N84KCUHHQ=\n-----END PUBLIC KEY-----\n",
      "signatureBase64": "16TArvH7pm2fzjrn8wQUwqbAGQYt2QYRHu48QYXjrlzgpsr3Ex4qKNMvVdGZ1/TYwOChNQmwBACvkVaNgvGvBg=="
    },
    "signer": {
      "keyReference": "local-po-key",
      "publicKeySha256": "2de20a39d0f1c13c15350e428ea0c70be50f8fbca26ec88758a8dcb1a880beee"
    }
  }
}
